{"action_types":[{"name":"CreateScenario","parameters":["scenario"],"preconditions":["schema_valid","pinned_snapshot","scenario_only","evidence_preserved","llm_confirmed"]},{"name":"AddRoadRestriction","parameters":["restriction"],"preconditions":["schema_valid","pinned_snapshot","scenario_only","evidence_preserved","llm_confirmed"]},{"name":"CreateFireIncident","parameters":["incident"],"preconditions":["schema_valid","pinned_snapshot","scenario_only","evidence_preserved","llm_confirmed"]},{"name":"AttachImportedPerimeter","parameters":["perimeter","source_ref"],"preconditions":["schema_valid","pinned_snapshot","scenario_only","evidence_preserved","llm_confirmed"]},{"name":"AttachEvidence","parameters":["source_ref"],"preconditions":["schema_valid","pinned_snapshot","scenario_only","evidence_preserved","llm_confirmed"]},{"name":"ValidateScenario","parameters":[],"preconditions":["schema_valid","pinned_snapshot","scenario_only","evidence_preserved","llm_confirmed"]},{"name":"RunScenario","parameters":["run_id"],"preconditions":["schema_valid","pinned_snapshot","scenario_only","evidence_preserved","llm_confirmed"]},{"name":"CancelRun","parameters":["run_id"],"preconditions":["schema_valid","pinned_snapshot","scenario_only","evidence_preserved","llm_confirmed"]},{"name":"CompareRuns","parameters":["run_ids"],"preconditions":["schema_valid","pinned_snapshot","scenario_only","evidence_preserved","llm_confirmed"]},{"name":"ChangeAnalysisPolicy","parameters":["ranking","objective"],"preconditions":["schema_valid","pinned_snapshot","scenario_only","evidence_preserved","llm_confirmed"]},{"name":"ExportResultBundle","parameters":["run_id"],"preconditions":["schema_valid","pinned_snapshot","scenario_only","evidence_preserved","llm_confirmed"]}],"functions":[{"class":"deterministic","input":"typed_objects","name":"compileRestrictions","output":"typed_results"},{"class":"deterministic","input":"typed_objects","name":"routeBaselineEvent","output":"typed_results"},{"class":"simulation","input":"typed_objects","name":"runSumoPair","output":"typed_results"},{"class":"deterministic","input":"typed_objects","name":"computeAccessibilityDelta","output":"typed_results"},{"class":"graph","input":"typed_objects","name":"projectScenarioGraph","output":"typed_results"},{"class":"graph","input":"typed_objects","name":"computeFixedPPR","output":"typed_results"},{"class":"system_one","input":"typed_objects","name":"scoreRelationTypesSystemOne","output":"typed_results"},{"class":"graph","input":"typed_objects","name":"computeConditionedPPR","output":"typed_results"},{"class":"graph","input":"typed_objects","name":"explainWitnessPaths","output":"typed_results"},{"class":"llm_optional","input":"typed_objects","name":"parseScenarioDraft","output":"typed_results"},{"class":"llm_optional","input":"typed_objects","name":"explainResult","output":"typed_results"},{"class":"llm_optional","input":"typed_objects","name":"proposeActionParameters","output":"typed_results"}],"interfaces":[{"name":"RestrictableNetworkElement"},{"name":"RoutableNetworkElement"},{"name":"AccessibleFacility"},{"name":"EmergencyResponder"},{"name":"ScenarioPerturbation"},{"name":"EvidenceBearing"},{"name":"SpatialObject"},{"name":"TemporalObject"}],"link_types":[{"dst":"RoadSegment","name":"ROAD_CONNECTS_TO","src":"RoadSegment"},{"dst":"RoadSegment","name":"ROUTE_USES_SEGMENT","src":"TransitRoute"},{"dst":"TransitRoute","name":"SEGMENT_USED_BY_ROUTE","src":"RoadSegment"},{"dst":"TransitRoute","name":"STOP_ON_ROUTE","src":"TransitStop"},{"dst":"RoadSegment","name":"FACILITY_ACCESSED_VIA","src":"AccessibleFacility"},{"dst":"AccessibleFacility","name":"SEGMENT_ACCESS_TO_FACILITY","src":"RoadSegment"},{"dst":"SpatialObject","name":"DISTRICT_CONTAINS","src":"District"},{"dst":"District","name":"CELL_LOCATED_IN","src":"PopulationCell"},{"dst":"SpatialObject","name":"INCIDENT_OCCURS_AT","src":"FireIncident"},{"dst":"RoadSegment","name":"INCIDENT_RESTRICTS","src":"FireIncident"},{"dst":"RoadRestriction","name":"SCENARIO_CONTAINS_RESTRICTION","src":"Scenario"},{"dst":"Scenario","name":"RUN_EVALUATES_SCENARIO","src":"SimulationRun"},{"dst":"EvidenceBearing","name":"OBSERVATION_ABOUT_OBJECT","src":"ImpactObservation"},{"dst":"EvidenceBearing","name":"DERIVED_FROM","src":"EvidenceBearing"},{"dst":"EvidenceSource","name":"SUPPORTED_BY_EVIDENCE","src":"EvidenceBearing"}],"object_types":[{"interfaces":["RestrictableNetworkElement","RoutableNetworkElement","SpatialObject","EvidenceBearing","TemporalObject"],"name":"RoadSegment"},{"interfaces":["RoutableNetworkElement","SpatialObject","EvidenceBearing","TemporalObject"],"name":"Junction"},{"interfaces":["EvidenceBearing","TemporalObject"],"name":"TransitRoute"},{"interfaces":["EvidenceBearing","TemporalObject"],"name":"TransitStop"},{"interfaces":["AccessibleFacility","SpatialObject","EvidenceBearing","TemporalObject"],"name":"Facility"},{"interfaces":["AccessibleFacility","SpatialObject","EvidenceBearing","TemporalObject"],"name":"Hospital"},{"interfaces":["AccessibleFacility","EmergencyResponder","SpatialObject","EvidenceBearing","TemporalObject"],"name":"FireStation"},{"interfaces":["EvidenceBearing","TemporalObject"],"name":"District"},{"interfaces":["EvidenceBearing","TemporalObject"],"name":"PopulationCell"},{"interfaces":["ScenarioPerturbation","SpatialObject","EvidenceBearing","TemporalObject"],"name":"FireIncident"},{"interfaces":["ScenarioPerturbation","EvidenceBearing","TemporalObject"],"name":"RoadRestriction"},{"interfaces":["EvidenceBearing","TemporalObject"],"name":"Scenario"},{"interfaces":["EvidenceBearing","TemporalObject"],"name":"SimulationRun"},{"interfaces":["EvidenceBearing","TemporalObject"],"name":"ImpactObservation"},{"interfaces":["EvidenceBearing","TemporalObject"],"name":"EvidenceSource"},{"interfaces":["EvidenceBearing","TemporalObject"],"name":"AnalysisPolicy"}],"ontology_version":"1.0.0","projections":[{"allowed_link_types":["ROAD_CONNECTS_TO","ROUTE_USES_SEGMENT","SEGMENT_USED_BY_ROUTE","STOP_ON_ROUTE","FACILITY_ACCESSED_VIA","SEGMENT_ACCESS_TO_FACILITY"],"allowed_object_types":["RoadSegment","TransitRoute","TransitStop","Facility","Hospital","FireStation"],"name":"road_fire_operational"}]}
